{"$schema":"https://json-schema.org/draft/2020-12/schema","$id":"https://kaveep.dev/dev-agent/schemas/write-transaction-journal.schema.json","title":"KAVEEP DEV-AGENT Write Transaction Journal","type":"object","required":["transactionId","schemaVersion","writeRequestRef","sourceRepositoryRoot","patchSha256","state","entries","createdAt","updatedAt"],"properties":{"transactionId":{"type":"string","pattern":"^write_transaction_[A-Za-z0-9][A-Za-z0-9_-]*$"},"schemaVersion":{"type":"string","const":"1.0.0"},"writeRequestRef":{"type":"string","pattern":"^controlled_write_request_[A-Za-z0-9][A-Za-z0-9_-]*$"},"sourceRepositoryRoot":{"type":"string","minLength":1},"patchSha256":{"type":"string","pattern":"^[a-f0-9]{64}$"},"state":{"type":"string","enum":["prepared","applying","completed","rolled_back","recovered","manual_recovery_required"]},"entries":{"type":"array","items":{"type":"object","required":["path","changeType","beforeSha256","afterSha256","backupRef"],"properties":{"path":{"type":"string","minLength":1},"changeType":{"type":"string","enum":["added","modified","deleted"]},"beforeSha256":{"type":["string","null"],"pattern":"^[a-f0-9]{64}$"},"afterSha256":{"type":["string","null"],"pattern":"^[a-f0-9]{64}$"},"backupRef":{"type":["string","null"]}},"additionalProperties":false}},"createdAt":{"type":"string","format":"date-time"},"updatedAt":{"type":"string","format":"date-time"}},"additionalProperties":false}
