{"transactionId":"write_transaction_example_001","schemaVersion":"1.0.0","writeRequestRef":"controlled_write_request_example_001","sourceRepositoryRoot":"C:/repositories/example","patchSha256":"aaaaaaaaaaaaaaaaaaaaaaaaaaaaaaaaaaaaaaaaaaaaaaaaaaaaaaaaaaaaaaaa","state":"prepared","entries":[{"path":"src/index.mjs","changeType":"modified","beforeSha256":"bbbbbbbbbbbbbbbbbbbbbbbbbbbbbbbbbbbbbbbbbbbbbbbbbbbbbbbbbbbbbbbb","afterSha256":"cccccccccccccccccccccccccccccccccccccccccccccccccccccccccccccccc","backupRef":"backups/src/index.mjs"}],"createdAt":"2026-07-11T00:00:00.000Z","updatedAt":"2026-07-11T00:00:00.000Z"}
